0.000000 IP 10.1.3.1.49153 > 10.1.1.2.50000: Flags [S], seq 0, win 32768, options [wscale 2,TS val 0 ecr 0,eol], length 0
0.062784 IP 10.1.1.2.50000 > 10.1.3.1.49153: Flags [S.], seq 0, ack 1, win 32768, options [wscale 2,TS val 31 ecr 0,eol], length 0
0.062784 IP 10.1.3.1.49153 > 10.1.1.2.50000: Flags [.], ack 1, win 32768, options [TS val 62 ecr 31,eol], length 0
0.063215 IP 10.1.3.1.49153 > 10.1.1.2.50000: Flags [.], seq 1:537, ack 1, win 32768, options [TS val 62 ecr 31,eol], length 536
0.138671 IP 10.1.1.2.50000 > 10.1.3.1.49153: Flags [.], ack 537, win 32768, options [TS val 107 ecr 62,eol], length 0
0.138671 IP 10.1.3.1.49153 > 10.1.1.2.50000: Flags [.], seq 537:1073, ack 1, win 32768, options [TS val 138 ecr 107,eol], length 536
0.143391 IP 10.1.3.1.49153 > 10.1.1.2.50000: Flags [.], seq 1073:1609, ack 1, win 32768, options [TS val 138 ecr 107,eol], length 536
0.218847 IP 10.1.1.2.50000 > 10.1.3.1.49153: Flags [.], ack 1609, win 32768, options [TS val 187 ecr 138,eol], length 0
0.218847 IP 10.1.3.1.49153 > 10.1.1.2.50000: Flags [.], seq 1609:2145, ack 1, win 32768, options [TS val 218 ecr 187,eol], length 536
0.223567 IP 10.1.3.1.49153 > 10.1.1.2.50000: Flags [.], seq 2145:2681, ack 1, win 32768, options [TS val 218 ecr 187,eol], length 536
0.228287 IP 10.1.3.1.49153 > 10.1.1.2.50000: Flags [.], seq 2681:3217, ack 1, win 32768, options [TS val 218 ecr 187,eol], length 536
0.299023 IP 10.1.1.2.50000 > 10.1.3.1.49153: Flags [.], ack 2681, win 32768, options [TS val 267 ecr 218,eol], length 0
0.299023 IP 10.1.3.1.49153 > 10.1.1.2.50000: Flags [.], seq 3217:3753, ack 1, win 32768, options [TS val 299 ecr 267,eol], length 536
0.303743 IP 10.1.3.1.49153 > 10.1.1.2.50000: Flags [.], seq 3753:4289, ack 1, win 32768, options [TS val 299 ecr 267,eol], length 536
0.308463 IP 10.1.3.1.49153 > 10.1.1.2.50000: Flags [.], seq 4289:4825, ack 1, win 32768, options [TS val 299 ecr 267,eol], length 536
0.374479 IP 10.1.1.2.50000 > 10.1.3.1.49153: Flags [.], ack 3753, win 32768, options [TS val 343 ecr 218,eol], length 0
0.374479 IP 10.1.3.1.49153 > 10.1.1.2.50000: Flags [.], seq 4825:5361, ack 1, win 32768, options [TS val 374 ecr 343,eol], length 536
0.379199 IP 10.1.3.1.49153 > 10.1.1.2.50000: Flags [.], seq 5361:5897, ack 1, win 32768, options [TS val 374 ecr 343,eol], length 536
0.383919 IP 10.1.1.2.50000 > 10.1.3.1.49153: Flags [.], ack 4825, win 32768, options [TS val 352 ecr 299,eol], length 0
0.383919 IP 10.1.3.1.49153 > 10.1.1.2.50000: Flags [.], seq 5897:6433, ack 1, win 32768, options [TS val 374 ecr 343,eol], length 536
0.388639 IP 10.1.3.1.49153 > 10.1.1.2.50000: Flags [.], seq 6433:6969, ack 1, win 32768, options [TS val 383 ecr 352,eol], length 536
0.393359 IP 10.1.3.1.49153 > 10.1.1.2.50000: Flags [.], seq 6969:7505, ack 1, win 32768, options [TS val 383 ecr 352,eol], length 536
0.398079 IP 10.1.3.1.49153 > 10.1.1.2.50000: Flags [.], seq 7505:8041, ack 1, win 32768, options [TS val 383 ecr 352,eol], length 536
0.454655 IP 10.1.1.2.50000 > 10.1.3.1.49153: Flags [.], ack 5897, win 32768, options [TS val 423 ecr 374,eol], length 0
0.454655 IP 10.1.3.1.49153 > 10.1.1.2.50000: Flags [.], seq 8041:8577, ack 1, win 32768, options [TS val 454 ecr 423,eol], length 536
0.459375 IP 10.1.3.1.49153 > 10.1.1.2.50000: Flags [.], seq 8577:9113, ack 1, win 32768, options [TS val 454 ecr 423,eol], length 536
0.464095 IP 10.1.1.2.50000 > 10.1.3.1.49153: Flags [.], ack 5897, win 32768, options [TS val 432 ecr 374,eol], length 0
0.464095 IP 10.1.3.1.49153 > 10.1.1.2.50000: Flags [.], seq 9113:9649, ack 1, win 32768, options [TS val 454 ecr 423,eol], length 536
0.468815 IP 10.1.1.2.50000 > 10.1.3.1.49153: Flags [.], ack 5897, win 32768, options [TS val 437 ecr 374,eol], length 0
0.468815 IP 10.1.3.1.49153 > 10.1.1.2.50000: Flags [.], seq 9649:10185, ack 1, win 32768, options [TS val 464 ecr 432,eol], length 536
0.473535 IP 10.1.1.2.50000 > 10.1.3.1.49153: Flags [.], ack 5897, win 32768, options [TS val 442 ecr 374,eol], length 0
0.473535 IP 10.1.3.1.49153 > 10.1.1.2.50000: Flags [.], seq 10185:10721, ack 1, win 32768, options [TS val 468 ecr 437,eol], length 536
0.478255 IP 10.1.3.1.49153 > 10.1.1.2.50000: Flags [.], seq 5897:6433, ack 1, win 32768, options [TS val 473 ecr 442,eol], length 536
0.530111 IP 10.1.1.2.50000 > 10.1.3.1.49153: Flags [.], ack 5897, win 32768, options [TS val 498 ecr 374,eol], length 0
0.534831 IP 10.1.1.2.50000 > 10.1.3.1.49153: Flags [.], ack 5897, win 32768, options [TS val 503 ecr 374,eol], length 0
0.539551 IP 10.1.1.2.50000 > 10.1.3.1.49153: Flags [.], ack 5897, win 32768, options [TS val 508 ecr 374,eol], length 0
0.544271 IP 10.1.1.2.50000 > 10.1.3.1.49153: Flags [.], ack 5897, win 32768, options [TS val 512 ecr 374,eol], length 0
0.544271 IP 10.1.3.1.49153 > 10.1.1.2.50000: Flags [.], seq 10721:11257, ack 1, win 32768, options [TS val 544 ecr 512,eol], length 536
0.548991 IP 10.1.1.2.50000 > 10.1.3.1.49153: Flags [.], ack 5897, win 32768, options [TS val 517 ecr 374,eol], length 0
0.548991 IP 10.1.3.1.49153 > 10.1.1.2.50000: Flags [.], seq 11257:11793, ack 1, win 32768, options [TS val 548 ecr 517,eol], length 536
0.553711 IP 10.1.1.2.50000 > 10.1.3.1.49153: Flags [.], ack 10721, win 32768, options [TS val 522 ecr 473,eol], length 0
0.553711 IP 10.1.3.1.49153 > 10.1.1.2.50000: Flags [.], seq 11793:12329, ack 1, win 32768, options [TS val 553 ecr 522,eol], length 536
0.624447 IP 10.1.1.2.50000 > 10.1.3.1.49153: Flags [.], ack 11793, win 32768, options [TS val 593 ecr 544,eol], length 0
0.624447 IP 10.1.3.1.49153 > 10.1.1.2.50000: Flags [.], seq 12329:12865, ack 1, win 32768, options [TS val 624 ecr 593,eol], length 536
0.629167 IP 10.1.3.1.49153 > 10.1.1.2.50000: Flags [.], seq 12865:13401, ack 1, win 32768, options [TS val 624 ecr 593,eol], length 536
0.699903 IP 10.1.1.2.50000 > 10.1.3.1.49153: Flags [.], ack 12865, win 32768, options [TS val 668 ecr 553,eol], length 0
0.699903 IP 10.1.3.1.49153 > 10.1.1.2.50000: Flags [.], seq 13401:13937, ack 1, win 32768, options [TS val 699 ecr 668,eol], length 536
0.704623 IP 10.1.3.1.49153 > 10.1.1.2.50000: Flags [.], seq 13937:14473, ack 1, win 32768, options [TS val 699 ecr 668,eol], length 536
0.775359 IP 10.1.1.2.50000 > 10.1.3.1.49153: Flags [.], ack 13937, win 32768, options [TS val 744 ecr 624,eol], length 0
0.775359 IP 10.1.3.1.49153 > 10.1.1.2.50000: Flags [.], seq 14473:15009, ack 1, win 32768, options [TS val 775 ecr 744,eol], length 536
0.780079 IP 10.1.3.1.49153 > 10.1.1.2.50000: Flags [.], seq 15009:15545, ack 1, win 32768, options [TS val 775 ecr 744,eol], length 536
0.850815 IP 10.1.1.2.50000 > 10.1.3.1.49153: Flags [.], ack 15009, win 32768, options [TS val 819 ecr 699,eol], length 0
0.850815 IP 10.1.3.1.49153 > 10.1.1.2.50000: Flags [.], seq 15545:16081, ack 1, win 32768, options [TS val 850 ecr 819,eol], length 536
0.855535 IP 10.1.3.1.49153 > 10.1.1.2.50000: Flags [.], seq 16081:16617, ack 1, win 32768, options [TS val 850 ecr 819,eol], length 536
0.860255 IP 10.1.3.1.49153 > 10.1.1.2.50000: Flags [.], seq 16617:17153, ack 1, win 32768, options [TS val 850 ecr 819,eol], length 536
0.930991 IP 10.1.1.2.50000 > 10.1.3.1.49153: Flags [.], ack 15545, win 32768, options [TS val 899 ecr 775,eol], length 0
0.930991 IP 10.1.3.1.49153 > 10.1.1.2.50000: Flags [.], seq 17153:17689, ack 1, win 32768, options [TS val 930 ecr 899,eol], length 536
0.935711 IP 10.1.1.2.50000 > 10.1.3.1.49153: Flags [.], ack 15545, win 32768, options [TS val 904 ecr 775,eol], length 0
0.935711 IP 10.1.3.1.49153 > 10.1.1.2.50000: Flags [.], seq 17689:18225, ack 1, win 32768, options [TS val 935 ecr 904,eol], length 536
1.006447 IP 10.1.1.2.50000 > 10.1.3.1.49153: Flags [.], ack 15545, win 32768, options [TS val 975 ecr 775,eol], length 0
1.006447 IP 10.1.3.1.49153 > 10.1.1.2.50000: Flags [.], seq 18225:18761, ack 1, win 32768, options [TS val 1006 ecr 975,eol], length 536
1.011167 IP 10.1.1.2.50000 > 10.1.3.1.49153: Flags [.], ack 15545, win 32768, options [TS val 979 ecr 775,eol], length 0
1.011167 IP 10.1.3.1.49153 > 10.1.1.2.50000: Flags [.], seq 15545:16081, ack 1, win 32768, options [TS val 1011 ecr 979,eol], length 536
1.086623 IP 10.1.1.2.50000 > 10.1.3.1.49153: Flags [.], ack 18225, win 32768, options [TS val 1055 ecr 1011,eol], length 0
1.086623 IP 10.1.3.1.49153 > 10.1.1.2.50000: Flags [.], seq 18225:18761, ack 1, win 32768, options [TS val 1086 ecr 1055,eol], length 536
1.362079 IP 10.1.1.2.50000 > 10.1.3.1.49153: Flags [.], ack 18761, win 32768, options [TS val 1330 ecr 1086,eol], length 0
1.362079 IP 10.1.3.1.49153 > 10.1.1.2.50000: Flags [.], seq 18761:19297, ack 1, win 32768, options [TS val 1362 ecr 1330,eol], length 536
1.366799 IP 10.1.3.1.49153 > 10.1.1.2.50000: Flags [.], seq 19297:19833, ack 1, win 32768, options [TS val 1362 ecr 1330,eol], length 536
1.442255 IP 10.1.1.2.50000 > 10.1.3.1.49153: Flags [.], ack 19833, win 32768, options [TS val 1410 ecr 1362,eol], length 0
1.442255 IP 10.1.3.1.49153 > 10.1.1.2.50000: Flags [.], seq 19833:20369, ack 1, win 32768, options [TS val 1442 ecr 1410,eol], length 536
1.446975 IP 10.1.3.1.49153 > 10.1.1.2.50000: Flags [.], seq 20369:20905, ack 1, win 32768, options [TS val 1442 ecr 1410,eol], length 536
1.522431 IP 10.1.1.2.50000 > 10.1.3.1.49153: Flags [.], ack 20905, win 32768, options [TS val 1491 ecr 1442,eol], length 0
1.522431 IP 10.1.3.1.49153 > 10.1.1.2.50000: Flags [.], seq 20905:21441, ack 1, win 32768, options [TS val 1522 ecr 1491,eol], length 536
1.527151 IP 10.1.3.1.49153 > 10.1.1.2.50000: Flags [.], seq 21441:21977, ack 1, win 32768, options [TS val 1522 ecr 1491,eol], length 536
1.602607 IP 10.1.1.2.50000 > 10.1.3.1.49153: Flags [.], ack 21977, win 32768, options [TS val 1571 ecr 1522,eol], length 0
1.602607 IP 10.1.3.1.49153 > 10.1.1.2.50000: Flags [.], seq 21977:22513, ack 1, win 32768, options [TS val 1602 ecr 1571,eol], length 536
1.607327 IP 10.1.3.1.49153 > 10.1.1.2.50000: Flags [.], seq 22513:23049, ack 1, win 32768, options [TS val 1602 ecr 1571,eol], length 536
1.612047 IP 10.1.3.1.49153 > 10.1.1.2.50000: Flags [.], seq 23049:23585, ack 1, win 32768, options [TS val 1602 ecr 1571,eol], length 536
1.682783 IP 10.1.1.2.50000 > 10.1.3.1.49153: Flags [.], ack 23049, win 32768, options [TS val 1651 ecr 1602,eol], length 0
1.682783 IP 10.1.3.1.49153 > 10.1.1.2.50000: Flags [.], seq 23585:24121, ack 1, win 32768, options [TS val 1682 ecr 1651,eol], length 536
1.687503 IP 10.1.3.1.49153 > 10.1.1.2.50000: Flags [.], seq 24121:24657, ack 1, win 32768, options [TS val 1682 ecr 1651,eol], length 536
1.758239 IP 10.1.1.2.50000 > 10.1.3.1.49153: Flags [.], ack 24121, win 32768, options [TS val 1726 ecr 1602,eol], length 0
1.758239 IP 10.1.3.1.49153 > 10.1.1.2.50000: Flags [.], seq 24657:25193, ack 1, win 32768, options [TS val 1758 ecr 1726,eol], length 536
1.762959 IP 10.1.3.1.49153 > 10.1.1.2.50000: Flags [.], seq 25193:25729, ack 1, win 32768, options [TS val 1758 ecr 1726,eol], length 536
1.833695 IP 10.1.1.2.50000 > 10.1.3.1.49153: Flags [.], ack 25193, win 32768, options [TS val 1802 ecr 1682,eol], length 0
1.833695 IP 10.1.3.1.49153 > 10.1.1.2.50000: Flags [.], seq 25729:26265, ack 1, win 32768, options [TS val 1833 ecr 1802,eol], length 536
1.838415 IP 10.1.3.1.49153 > 10.1.1.2.50000: Flags [.], seq 26265:26801, ack 1, win 32768, options [TS val 1833 ecr 1802,eol], length 536
1.843135 IP 10.1.3.1.49153 > 10.1.1.2.50000: Flags [.], seq 26801:27337, ack 1, win 32768, options [TS val 1833 ecr 1802,eol], length 536
1.909151 IP 10.1.1.2.50000 > 10.1.3.1.49153: Flags [.], ack 26265, win 32768, options [TS val 1877 ecr 1758,eol], length 0
1.909151 IP 10.1.3.1.49153 > 10.1.1.2.50000: Flags [.], seq 27337:27873, ack 1, win 32768, options [TS val 1909 ecr 1877,eol], length 536
1.913871 IP 10.1.3.1.49153 > 10.1.1.2.50000: Flags [.], seq 27873:28409, ack 1, win 32768, options [TS val 1909 ecr 1877,eol], length 536
1.918591 IP 10.1.1.2.50000 > 10.1.3.1.49153: Flags [.], ack 27337, win 32768, options [TS val 1887 ecr 1833,eol], length 0
1.918591 IP 10.1.3.1.49153 > 10.1.1.2.50000: Flags [.], seq 28409:28945, ack 1, win 32768, options [TS val 1918 ecr 1887,eol], length 536
1.923311 IP 10.1.3.1.49153 > 10.1.1.2.50000: Flags [.], seq 28945:29481, ack 1, win 32768, options [TS val 1918 ecr 1887,eol], length 536
1.989327 IP 10.1.1.2.50000 > 10.1.3.1.49153: Flags [.], ack 28409, win 32768, options [TS val 1958 ecr 1909,eol], length 0
1.989327 IP 10.1.3.1.49153 > 10.1.1.2.50000: Flags [.], seq 29481:30017, ack 1, win 32768, options [TS val 1989 ecr 1958,eol], length 536
1.994047 IP 10.1.3.1.49153 > 10.1.1.2.50000: Flags [.], seq 30017:30553, ack 1, win 32768, options [TS val 1989 ecr 1958,eol], length 536
1.998767 IP 10.1.1.2.50000 > 10.1.3.1.49153: Flags [.], ack 29481, win 32768, options [TS val 1967 ecr 1918,eol], length 0
1.998767 IP 10.1.3.1.49153 > 10.1.1.2.50000: Flags [.], seq 30553:31089, ack 1, win 32768, options [TS val 1998 ecr 1967,eol], length 536
2.003487 IP 10.1.3.1.49153 > 10.1.1.2.50000: Flags [.], seq 31089:31625, ack 1, win 32768, options [TS val 1998 ecr 1967,eol], length 536
2.069503 IP 10.1.1.2.50000 > 10.1.3.1.49153: Flags [.], ack 30553, win 32768, options [TS val 2038 ecr 1989,eol], length 0
2.069503 IP 10.1.3.1.49153 > 10.1.1.2.50000: Flags [.], seq 31625:32161, ack 1, win 32768, options [TS val 2069 ecr 2038,eol], length 536
2.074223 IP 10.1.3.1.49153 > 10.1.1.2.50000: Flags [.], seq 32161:32697, ack 1, win 32768, options [TS val 2069 ecr 2038,eol], length 536
2.078943 IP 10.1.1.2.50000 > 10.1.3.1.49153: Flags [.], ack 31625, win 32768, options [TS val 2047 ecr 1998,eol], length 0
2.078943 IP 10.1.3.1.49153 > 10.1.1.2.50000: Flags [.], seq 32697:33233, ack 1, win 32768, options [TS val 2069 ecr 2038,eol], length 536
2.083663 IP 10.1.3.1.49153 > 10.1.1.2.50000: Flags [.], seq 33233:33769, ack 1, win 32768, options [TS val 2078 ecr 2047,eol], length 536
2.088383 IP 10.1.3.1.49153 > 10.1.1.2.50000: Flags [.], seq 33769:34305, ack 1, win 32768, options [TS val 2078 ecr 2047,eol], length 536
2.149679 IP 10.1.1.2.50000 > 10.1.3.1.49153: Flags [.], ack 32697, win 32768, options [TS val 2118 ecr 2069,eol], length 0
2.149679 IP 10.1.3.1.49153 > 10.1.1.2.50000: Flags [.], seq 34305:34841, ack 1, win 32768, options [TS val 2149 ecr 2118,eol], length 536
2.154399 IP 10.1.3.1.49153 > 10.1.1.2.50000: Flags [.], seq 34841:35377, ack 1, win 32768, options [TS val 2149 ecr 2118,eol], length 536
2.159119 IP 10.1.1.2.50000 > 10.1.3.1.49153: Flags [.], ack 33769, win 32768, options [TS val 2127 ecr 2069,eol], length 0
2.159119 IP 10.1.3.1.49153 > 10.1.1.2.50000: Flags [.], seq 35377:35913, ack 1, win 32768, options [TS val 2159 ecr 2127,eol], length 536
2.163839 IP 10.1.3.1.49153 > 10.1.1.2.50000: Flags [.], seq 35913:36449, ack 1, win 32768, options [TS val 2159 ecr 2127,eol], length 536
2.225135 IP 10.1.1.2.50000 > 10.1.3.1.49153: Flags [.], ack 34841, win 32768, options [TS val 2193 ecr 2078,eol], length 0
2.225135 IP 10.1.3.1.49153 > 10.1.1.2.50000: Flags [.], seq 36449:36985, ack 1, win 32768, options [TS val 2225 ecr 2193,eol], length 536
2.229855 IP 10.1.3.1.49153 > 10.1.1.2.50000: Flags [.], seq 36985:37521, ack 1, win 32768, options [TS val 2225 ecr 2193,eol], length 536
2.234575 IP 10.1.1.2.50000 > 10.1.3.1.49153: Flags [.], ack 35913, win 32768, options [TS val 2203 ecr 2149,eol], length 0
2.234575 IP 10.1.3.1.49153 > 10.1.1.2.50000: Flags [.], seq 37521:38057, ack 1, win 32768, options [TS val 2234 ecr 2203,eol], length 536
2.239295 IP 10.1.3.1.49153 > 10.1.1.2.50000: Flags [.], seq 38057:38593, ack 1, win 32768, options [TS val 2234 ecr 2203,eol], length 536
2.244015 IP 10.1.3.1.49153 > 10.1.1.2.50000: Flags [.], seq 38593:39129, ack 1, win 32768, options [TS val 2234 ecr 2203,eol], length 536
2.300591 IP 10.1.1.2.50000 > 10.1.3.1.49153: Flags [.], ack 36985, win 32768, options [TS val 2269 ecr 2159,eol], length 0
2.300591 IP 10.1.3.1.49153 > 10.1.1.2.50000: Flags [.], seq 39129:39665, ack 1, win 32768, options [TS val 2300 ecr 2269,eol], length 536
2.305311 IP 10.1.3.1.49153 > 10.1.1.2.50000: Flags [.], seq 39665:40201, ack 1, win 32768, options [TS val 2300 ecr 2269,eol], length 536
2.310031 IP 10.1.1.2.50000 > 10.1.3.1.49153: Flags [.], ack 38057, win 32768, options [TS val 2278 ecr 2225,eol], length 0
2.310031 IP 10.1.3.1.49153 > 10.1.1.2.50000: Flags [.], seq 40201:40737, ack 1, win 32768, options [TS val 2310 ecr 2278,eol], length 536
2.314751 IP 10.1.3.1.49153 > 10.1.1.2.50000: Flags [.], seq 40737:41273, ack 1, win 32768, options [TS val 2310 ecr 2278,eol], length 536
2.319471 IP 10.1.1.2.50000 > 10.1.3.1.49153: Flags [.], ack 39129, win 32768, options [TS val 2288 ecr 2234,eol], length 0
2.319471 IP 10.1.3.1.49153 > 10.1.1.2.50000: Flags [.], seq 41273:41809, ack 1, win 32768, options [TS val 2319 ecr 2288,eol], length 536
2.324191 IP 10.1.3.1.49153 > 10.1.1.2.50000: Flags [.], seq 41809:42345, ack 1, win 32768, options [TS val 2319 ecr 2288,eol], length 536
2.380767 IP 10.1.1.2.50000 > 10.1.3.1.49153: Flags [.], ack 40201, win 32768, options [TS val 2349 ecr 2300,eol], length 0
2.380767 IP 10.1.3.1.49153 > 10.1.1.2.50000: Flags [.], seq 42345:42881, ack 1, win 32768, options [TS val 2380 ecr 2349,eol], length 536
2.385487 IP 10.1.3.1.49153 > 10.1.1.2.50000: Flags [.], seq 42881:43417, ack 1, win 32768, options [TS val 2380 ecr 2349,eol], length 536
2.390207 IP 10.1.1.2.50000 > 10.1.3.1.49153: Flags [.], ack 41273, win 32768, options [TS val 2358 ecr 2310,eol], length 0
2.390207 IP 10.1.3.1.49153 > 10.1.1.2.50000: Flags [.], seq 43417:43953, ack 1, win 32768, options [TS val 2390 ecr 2358,eol], length 536
2.394927 IP 10.1.3.1.49153 > 10.1.1.2.50000: Flags [.], seq 43953:44489, ack 1, win 32768, options [TS val 2390 ecr 2358,eol], length 536
2.399647 IP 10.1.1.2.50000 > 10.1.3.1.49153: Flags [.], ack 42345, win 32768, options [TS val 2368 ecr 2319,eol], length 0
2.399647 IP 10.1.3.1.49153 > 10.1.1.2.50000: Flags [.], seq 44489:45025, ack 1, win 32768, options [TS val 2399 ecr 2368,eol], length 536
2.404367 IP 10.1.3.1.49153 > 10.1.1.2.50000: Flags [.], seq 45025:45561, ack 1, win 32768, options [TS val 2399 ecr 2368,eol], length 536
2.409087 IP 10.1.3.1.49153 > 10.1.1.2.50000: Flags [.], seq 45561:46097, ack 1, win 32768, options [TS val 2399 ecr 2368,eol], length 536
2.460943 IP 10.1.1.2.50000 > 10.1.3.1.49153: Flags [.], ack 43417, win 32768, options [TS val 2429 ecr 2380,eol], length 0
2.460943 IP 10.1.3.1.49153 > 10.1.1.2.50000: Flags [.], seq 46097:46633, ack 1, win 32768, options [TS val 2460 ecr 2429,eol], length 536
2.465663 IP 10.1.3.1.49153 > 10.1.1.2.50000: Flags [.], seq 46633:47169, ack 1, win 32768, options [TS val 2460 ecr 2429,eol], length 536
2.470383 IP 10.1.1.2.50000 > 10.1.3.1.49153: Flags [.], ack 44489, win 32768, options [TS val 2439 ecr 2390,eol], length 0
2.470383 IP 10.1.3.1.49153 > 10.1.1.2.50000: Flags [.], seq 47169:47705, ack 1, win 32768, options [TS val 2470 ecr 2439,eol], length 536
2.475103 IP 10.1.3.1.49153 > 10.1.1.2.50000: Flags [.], seq 47705:48241, ack 1, win 32768, options [TS val 2470 ecr 2439,eol], length 536
2.479823 IP 10.1.1.2.50000 > 10.1.3.1.49153: Flags [.], ack 45561, win 32768, options [TS val 2448 ecr 2399,eol], length 0
2.479823 IP 10.1.3.1.49153 > 10.1.1.2.50000: Flags [.], seq 48241:48777, ack 1, win 32768, options [TS val 2479 ecr 2448,eol], length 536
2.484543 IP 10.1.3.1.49153 > 10.1.1.2.50000: Flags [.], seq 48777:49313, ack 1, win 32768, options [TS val 2479 ecr 2448,eol], length 536
2.536399 IP 10.1.1.2.50000 > 10.1.3.1.49153: Flags [.], ack 46633, win 32768, options [TS val 2505 ecr 2399,eol], length 0
2.536399 IP 10.1.3.1.49153 > 10.1.1.2.50000: Flags [.], seq 49313:49849, ack 1, win 32768, options [TS val 2536 ecr 2505,eol], length 536
2.541119 IP 10.1.3.1.49153 > 10.1.1.2.50000: Flags [.], seq 49849:50385, ack 1, win 32768, options [TS val 2536 ecr 2505,eol], length 536
2.545839 IP 10.1.1.2.50000 > 10.1.3.1.49153: Flags [.], ack 47705, win 32768, options [TS val 2514 ecr 2460,eol], length 0
2.545839 IP 10.1.3.1.49153 > 10.1.1.2.50000: Flags [.], seq 50385:50921, ack 1, win 32768, options [TS val 2545 ecr 2514,eol], length 536
2.550559 IP 10.1.3.1.49153 > 10.1.1.2.50000: Flags [.], seq 50921:51457, ack 1, win 32768, options [TS val 2545 ecr 2514,eol], length 536
2.555279 IP 10.1.1.2.50000 > 10.1.3.1.49153: Flags [.], ack 48777, win 32768, options [TS val 2523 ecr 2470,eol], length 0
2.555279 IP 10.1.3.1.49153 > 10.1.1.2.50000: Flags [.], seq 51457:51993, ack 1, win 32768, options [TS val 2555 ecr 2523,eol], length 536
2.559999 IP 10.1.3.1.49153 > 10.1.1.2.50000: Flags [.], seq 51993:52529, ack 1, win 32768, options [TS val 2555 ecr 2523,eol], length 536
2.611855 IP 10.1.1.2.50000 > 10.1.3.1.49153: Flags [.], ack 49849, win 32768, options [TS val 2580 ecr 2479,eol], length 0
2.611855 IP 10.1.3.1.49153 > 10.1.1.2.50000: Flags [.], seq 52529:53065, ack 1, win 32768, options [TS val 2611 ecr 2580,eol], length 536
2.616575 IP 10.1.3.1.49153 > 10.1.1.2.50000: Flags [.], seq 53065:53601, ack 1, win 32768, options [TS val 2611 ecr 2580,eol], length 536
2.621295 IP 10.1.1.2.50000 > 10.1.3.1.49153: Flags [.], ack 50921, win 32768, options [TS val 2589 ecr 2536,eol], length 0
2.621295 IP 10.1.3.1.49153 > 10.1.1.2.50000: Flags [.], seq 53601:54137, ack 1, win 32768, options [TS val 2621 ecr 2589,eol], length 536
2.626015 IP 10.1.3.1.49153 > 10.1.1.2.50000: Flags [.], seq 54137:54673, ack 1, win 32768, options [TS val 2621 ecr 2589,eol], length 536
2.630735 IP 10.1.1.2.50000 > 10.1.3.1.49153: Flags [.], ack 51993, win 32768, options [TS val 2599 ecr 2545,eol], length 0
2.630735 IP 10.1.3.1.49153 > 10.1.1.2.50000: Flags [.], seq 54673:55209, ack 1, win 32768, options [TS val 2621 ecr 2589,eol], length 536
2.635455 IP 10.1.3.1.49153 > 10.1.1.2.50000: Flags [.], seq 55209:55745, ack 1, win 32768, options [TS val 2630 ecr 2599,eol], length 536
2.640175 IP 10.1.3.1.49153 > 10.1.1.2.50000: Flags [.], seq 55745:56281, ack 1, win 32768, options [TS val 2630 ecr 2599,eol], length 536
2.687311 IP 10.1.1.2.50000 > 10.1.3.1.49153: Flags [.], ack 53065, win 32768, options [TS val 2656 ecr 2555,eol], length 0
2.687311 IP 10.1.3.1.49153 > 10.1.1.2.50000: Flags [.], seq 56281:56817, ack 1, win 32768, options [TS val 2687 ecr 2656,eol], length 536
2.692031 IP 10.1.3.1.49153 > 10.1.1.2.50000: Flags [.], seq 56817:57353, ack 1, win 32768, options [TS val 2687 ecr 2656,eol], length 536
2.696751 IP 10.1.1.2.50000 > 10.1.3.1.49153: Flags [.], ack 54137, win 32768, options [TS val 2665 ecr 2611,eol], length 0
2.696751 IP 10.1.3.1.49153 > 10.1.1.2.50000: Flags [.], seq 57353:57889, ack 1, win 32768, options [TS val 2696 ecr 2665,eol], length 536
2.701471 IP 10.1.3.1.49153 > 10.1.1.2.50000: Flags [.], seq 57889:58425, ack 1, win 32768, options [TS val 2696 ecr 2665,eol], length 536
2.706191 IP 10.1.1.2.50000 > 10.1.3.1.49153: Flags [.], ack 55209, win 32768, options [TS val 2674 ecr 2621,eol], length 0
2.706191 IP 10.1.3.1.49153 > 10.1.1.2.50000: Flags [.], seq 58425:58961, ack 1, win 32768, options [TS val 2706 ecr 2674,eol], length 536
2.710911 IP 10.1.3.1.49153 > 10.1.1.2.50000: Flags [.], seq 58961:59497, ack 1, win 32768, options [TS val 2706 ecr 2674,eol], length 536
2.715631 IP 10.1.1.2.50000 > 10.1.3.1.49153: Flags [.], ack 56281, win 32768, options [TS val 2684 ecr 2630,eol], length 0
2.715631 IP 10.1.3.1.49153 > 10.1.1.2.50000: Flags [.], seq 59497:60033, ack 1, win 32768, options [TS val 2715 ecr 2684,eol], length 536
2.720351 IP 10.1.3.1.49153 > 10.1.1.2.50000: Flags [.], seq 60033:60569, ack 1, win 32768, options [TS val 2715 ecr 2684,eol], length 536
2.767487 IP 10.1.1.2.50000 > 10.1.3.1.49153: Flags [.], ack 57353, win 32768, options [TS val 2736 ecr 2687,eol], length 0
2.767487 IP 10.1.3.1.49153 > 10.1.1.2.50000: Flags [.], seq 60569:61105, ack 1, win 32768, options [TS val 2767 ecr 2736,eol], length 536
2.772207 IP 10.1.3.1.49153 > 10.1.1.2.50000: Flags [.], seq 61105:61641, ack 1, win 32768, options [TS val 2767 ecr 2736,eol], length 536
2.776927 IP 10.1.1.2.50000 > 10.1.3.1.49153: Flags [.], ack 58425, win 32768, options [TS val 2745 ecr 2696,eol], length 0
2.776927 IP 10.1.3.1.49153 > 10.1.1.2.50000: Flags [.], seq 61641:62177, ack 1, win 32768, options [TS val 2776 ecr 2745,eol], length 536
2.781647 IP 10.1.3.1.49153 > 10.1.1.2.50000: Flags [.], seq 62177:62713, ack 1, win 32768, options [TS val 2776 ecr 2745,eol], length 536
2.786367 IP 10.1.1.2.50000 > 10.1.3.1.49153: Flags [.], ack 59497, win 32768, options [TS val 2755 ecr 2706,eol], length 0
2.786367 IP 10.1.3.1.49153 > 10.1.1.2.50000: Flags [.], seq 62713:63249, ack 1, win 32768, options [TS val 2786 ecr 2755,eol], length 536
2.791087 IP 10.1.3.1.49153 > 10.1.1.2.50000: Flags [.], seq 63249:63785, ack 1, win 32768, options [TS val 2786 ecr 2755,eol], length 536
2.795807 IP 10.1.1.2.50000 > 10.1.3.1.49153: Flags [.], ack 60569, win 32768, options [TS val 2764 ecr 2715,eol], length 0
2.795807 IP 10.1.3.1.49153 > 10.1.1.2.50000: Flags [.], seq 63785:64321, ack 1, win 32768, options [TS val 2786 ecr 2755,eol], length 536
2.800527 IP 10.1.3.1.49153 > 10.1.1.2.50000: Flags [.], seq 64321:64857, ack 1, win 32768, options [TS val 2795 ecr 2764,eol], length 536
2.805247 IP 10.1.3.1.49153 > 10.1.1.2.50000: Flags [.], seq 64857:65393, ack 1, win 32768, options [TS val 2795 ecr 2764,eol], length 536
2.847663 IP 10.1.1.2.50000 > 10.1.3.1.49153: Flags [.], ack 61641, win 32768, options [TS val 2816 ecr 2767,eol], length 0
2.847663 IP 10.1.3.1.49153 > 10.1.1.2.50000: Flags [.], seq 65393:65929, ack 1, win 32768, options [TS val 2847 ecr 2816,eol], length 536
2.852383 IP 10.1.3.1.49153 > 10.1.1.2.50000: Flags [.], seq 65929:66465, ack 1, win 32768, options [TS val 2847 ecr 2816,eol], length 536
2.857103 IP 10.1.1.2.50000 > 10.1.3.1.49153: Flags [.], ack 62713, win 32768, options [TS val 2825 ecr 2776,eol], length 0
2.857103 IP 10.1.3.1.49153 > 10.1.1.2.50000: Flags [.], seq 66465:67001, ack 1, win 32768, options [TS val 2857 ecr 2825,eol], length 536
2.861823 IP 10.1.3.1.49153 > 10.1.1.2.50000: Flags [.], seq 67001:67537, ack 1, win 32768, options [TS val 2857 ecr 2825,eol], length 536
2.866543 IP 10.1.1.2.50000 > 10.1.3.1.49153: Flags [.], ack 62713, win 32768, options [TS val 2835 ecr 2776,eol], length 0
2.866543 IP 10.1.3.1.49153 > 10.1.1.2.50000: Flags [.], seq 67537:68073, ack 1, win 32768, options [TS val 2866 ecr 2835,eol], length 536
2.875983 IP 10.1.1.2.50000 > 10.1.3.1.49153: Flags [.], ack 62713, win 32768, options [TS val 2844 ecr 2776,eol], length 0
2.875983 IP 10.1.3.1.49153 > 10.1.1.2.50000: Flags [.], seq 68073:68609, ack 1, win 32768, options [TS val 2875 ecr 2844,eol], length 536
2.880703 IP 10.1.1.2.50000 > 10.1.3.1.49153: Flags [.], ack 62713, win 32768, options [TS val 2849 ecr 2776,eol], length 0
2.880703 IP 10.1.3.1.49153 > 10.1.1.2.50000: Flags [.], seq 62713:63249, ack 1, win 32768, options [TS val 2880 ecr 2849,eol], length 536
2.923119 IP 10.1.1.2.50000 > 10.1.3.1.49153: Flags [.], ack 62713, win 32768, options [TS val 2891 ecr 2776,eol], length 0
2.927839 IP 10.1.1.2.50000 > 10.1.3.1.49153: Flags [.], ack 62713, win 32768, options [TS val 2896 ecr 2776,eol], length 0
2.937279 IP 10.1.1.2.50000 > 10.1.3.1.49153: Flags [.], ack 62713, win 32768, options [TS val 2905 ecr 2776,eol], length 0
2.941999 IP 10.1.1.2.50000 > 10.1.3.1.49153: Flags [.], ack 62713, win 32768, options [TS val 2910 ecr 2776,eol], length 0
2.951439 IP 10.1.1.2.50000 > 10.1.3.1.49153: Flags [.], ack 62713, win 32768, options [TS val 2920 ecr 2776,eol], length 0
2.951439 IP 10.1.3.1.49153 > 10.1.1.2.50000: Flags [.], seq 68609:69145, ack 1, win 32768, options [TS val 2951 ecr 2920,eol], length 536
2.956159 IP 10.1.1.2.50000 > 10.1.3.1.49153: Flags [.], ack 63785, win 32768, options [TS val 2924 ecr 2880,eol], length 0
2.956159 IP 10.1.3.1.49153 > 10.1.1.2.50000: Flags [.], seq 63785:64321, ack 1, win 32768, options [TS val 2956 ecr 2924,eol], length 536
2.960879 IP 10.1.3.1.49153 > 10.1.1.2.50000: Flags [.], seq 69145:69681, ack 1, win 32768, options [TS val 2956 ecr 2924,eol], length 536
3.026895 IP 10.1.1.2.50000 > 10.1.3.1.49153: Flags [.], ack 63785, win 32768, options [TS val 2995 ecr 2880,eol], length 0
3.026895 IP 10.1.3.1.49153 > 10.1.1.2.50000: Flags [.], seq 69681:70217, ack 1, win 32768, options [TS val 3026 ecr 2995,eol], length 536
3.031615 IP 10.1.1.2.50000 > 10.1.3.1.49153: Flags [.], ack 66465, win 32768, options [TS val 3000 ecr 2956,eol], length 0
3.031615 IP 10.1.3.1.49153 > 10.1.1.2.50000: Flags [.], seq 66465:67001, ack 1, win 32768, options [TS val 3031 ecr 3000,eol], length 536
3.036335 IP 10.1.1.2.50000 > 10.1.3.1.49153: Flags [.], ack 66465, win 32768, options [TS val 3005 ecr 2956,eol], length 0
3.036335 IP 10.1.3.1.49153 > 10.1.1.2.50000: Flags [.], seq 70217:70753, ack 1, win 32768, options [TS val 3031 ecr 3000,eol], length 536
3.041055 IP 10.1.3.1.49153 > 10.1.1.2.50000: Flags [.], seq 70753:71289, ack 1, win 32768, options [TS val 3036 ecr 3005,eol], length 536
3.102351 IP 10.1.1.2.50000 > 10.1.3.1.49153: Flags [.], ack 66465, win 32768, options [TS val 3071 ecr 2956,eol], length 0
3.102351 IP 10.1.3.1.49153 > 10.1.1.2.50000: Flags [.], seq 71289:71825, ack 1, win 32768, options [TS val 3102 ecr 3071,eol], length 536
3.107071 IP 10.1.1.2.50000 > 10.1.3.1.49153: Flags [.], ack 70217, win 32768, options [TS val 3075 ecr 3031,eol], length 0
3.107071 IP 10.1.3.1.49153 > 10.1.1.2.50000: Flags [.], seq 71825:72361, ack 1, win 32768, options [TS val 3107 ecr 3075,eol], length 536
3.116511 IP 10.1.1.2.50000 > 10.1.3.1.49153: Flags [.], ack 71289, win 32768, options [TS val 3085 ecr 3031,eol], length 0
3.116511 IP 10.1.3.1.49153 > 10.1.1.2.50000: Flags [.], seq 72361:72897, ack 1, win 32768, options [TS val 3116 ecr 3085,eol], length 536
3.121231 IP 10.1.3.1.49153 > 10.1.1.2.50000: Flags [.], seq 72897:73433, ack 1, win 32768, options [TS val 3116 ecr 3085,eol], length 536
3.182527 IP 10.1.1.2.50000 > 10.1.3.1.49153: Flags [.], ack 72361, win 32768, options [TS val 3151 ecr 3102,eol], length 0
3.182527 IP 10.1.3.1.49153 > 10.1.1.2.50000: Flags [.], seq 73433:73969, ack 1, win 32768, options [TS val 3182 ecr 3151,eol], length 536
3.187247 IP 10.1.3.1.49153 > 10.1.1.2.50000: Flags [.], seq 73969:74505, ack 1, win 32768, options [TS val 3182 ecr 3151,eol], length 536
3.196687 IP 10.1.1.2.50000 > 10.1.3.1.49153: Flags [.], ack 73433, win 32768, options [TS val 3165 ecr 3116,eol], length 0
3.196687 IP 10.1.3.1.49153 > 10.1.1.2.50000: Flags [.], seq 74505:75041, ack 1, win 32768, options [TS val 3196 ecr 3165,eol], length 536
3.201407 IP 10.1.3.1.49153 > 10.1.1.2.50000: Flags [.], seq 75041:75577, ack 1, win 32768, options [TS val 3196 ecr 3165,eol], length 536
3.262703 IP 10.1.1.2.50000 > 10.1.3.1.49153: Flags [.], ack 74505, win 32768, options [TS val 3231 ecr 3182,eol], length 0
3.262703 IP 10.1.3.1.49153 > 10.1.1.2.50000: Flags [.], seq 75577:76113, ack 1, win 32768, options [TS val 3262 ecr 3231,eol], length 536
3.267423 IP 10.1.3.1.49153 > 10.1.1.2.50000: Flags [.], seq 76113:76649, ack 1, win 32768, options [TS val 3262 ecr 3231,eol], length 536
3.272143 IP 10.1.3.1.49153 > 10.1.1.2.50000: Flags [.], seq 76649:77185, ack 1, win 32768, options [TS val 3262 ecr 3231,eol], length 536
3.276863 IP 10.1.1.2.50000 > 10.1.3.1.49153: Flags [.], ack 75577, win 32768, options [TS val 3245 ecr 3196,eol], length 0
3.276863 IP 10.1.3.1.49153 > 10.1.1.2.50000: Flags [.], seq 77185:77721, ack 1, win 32768, options [TS val 3276 ecr 3245,eol], length 536
3.281583 IP 10.1.3.1.49153 > 10.1.1.2.50000: Flags [.], seq 77721:78257, ack 1, win 32768, options [TS val 3276 ecr 3245,eol], length 536
3.342879 IP 10.1.1.2.50000 > 10.1.3.1.49153: Flags [.], ack 76649, win 32768, options [TS val 3311 ecr 3262,eol], length 0
3.342879 IP 10.1.3.1.49153 > 10.1.1.2.50000: Flags [.], seq 78257:78793, ack 1, win 32768, options [TS val 3342 ecr 3311,eol], length 536
3.347599 IP 10.1.3.1.49153 > 10.1.1.2.50000: Flags [.], seq 78793:79329, ack 1, win 32768, options [TS val 3342 ecr 3311,eol], length 536
3.352319 IP 10.1.1.2.50000 > 10.1.3.1.49153: Flags [.], ack 77721, win 32768, options [TS val 3321 ecr 3262,eol], length 0
3.352319 IP 10.1.3.1.49153 > 10.1.1.2.50000: Flags [.], seq 79329:79865, ack 1, win 32768, options [TS val 3352 ecr 3321,eol], length 536
3.357039 IP 10.1.3.1.49153 > 10.1.1.2.50000: Flags [.], seq 79865:80401, ack 1, win 32768, options [TS val 3352 ecr 3321,eol], length 536
3.418335 IP 10.1.1.2.50000 > 10.1.3.1.49153: Flags [.], ack 78793, win 32768, options [TS val 3387 ecr 3276,eol], length 0
3.418335 IP 10.1.3.1.49153 > 10.1.1.2.50000: Flags [.], seq 80401:80937, ack 1, win 32768, options [TS val 3418 ecr 3387,eol], length 536
3.423055 IP 10.1.3.1.49153 > 10.1.1.2.50000: Flags [.], seq 80937:81473, ack 1, win 32768, options [TS val 3418 ecr 3387,eol], length 536
3.427775 IP 10.1.1.2.50000 > 10.1.3.1.49153: Flags [.], ack 79865, win 32768, options [TS val 3396 ecr 3342,eol], length 0
3.427775 IP 10.1.3.1.49153 > 10.1.1.2.50000: Flags [.], seq 81473:82009, ack 1, win 32768, options [TS val 3427 ecr 3396,eol], length 536
3.432495 IP 10.1.3.1.49153 > 10.1.1.2.50000: Flags [.], seq 82009:82545, ack 1, win 32768, options [TS val 3427 ecr 3396,eol], length 536
3.437215 IP 10.1.3.1.49153 > 10.1.1.2.50000: Flags [.], seq 82545:83081, ack 1, win 32768, options [TS val 3427 ecr 3396,eol], length 536
3.493791 IP 10.1.1.2.50000 > 10.1.3.1.49153: Flags [.], ack 80937, win 32768, options [TS val 3462 ecr 3352,eol], length 0
3.493791 IP 10.1.3.1.49153 > 10.1.1.2.50000: Flags [.], seq 83081:83617, ack 1, win 32768, options [TS val 3493 ecr 3462,eol], length 536
3.498511 IP 10.1.3.1.49153 > 10.1.1.2.50000: Flags [.], seq 83617:84153, ack 1, win 32768, options [TS val 3493 ecr 3462,eol], length 536
3.503231 IP 10.1.1.2.50000 > 10.1.3.1.49153: Flags [.], ack 82009, win 32768, options [TS val 3471 ecr 3418,eol], length 0
3.503231 IP 10.1.3.1.49153 > 10.1.1.2.50000: Flags [.], seq 84153:84689, ack 1, win 32768, options [TS val 3503 ecr 3471,eol], length 536
3.507951 IP 10.1.3.1.49153 > 10.1.1.2.50000: Flags [.], seq 84689:85225, ack 1, win 32768, options [TS val 3503 ecr 3471,eol], length 536
3.512671 IP 10.1.1.2.50000 > 10.1.3.1.49153: Flags [.], ack 83081, win 32768, options [TS val 3481 ecr 3427,eol], length 0
3.512671 IP 10.1.3.1.49153 > 10.1.1.2.50000: Flags [.], seq 85225:85761, ack 1, win 32768, options [TS val 3512 ecr 3481,eol], length 536
3.517391 IP 10.1.3.1.49153 > 10.1.1.2.50000: Flags [.], seq 85761:86297, ack 1, win 32768, options [TS val 3512 ecr 3481,eol], length 536
3.573967 IP 10.1.1.2.50000 > 10.1.3.1.49153: Flags [.], ack 84153, win 32768, options [TS val 3542 ecr 3493,eol], length 0
3.573967 IP 10.1.3.1.49153 > 10.1.1.2.50000: Flags [.], seq 86297:86833, ack 1, win 32768, options [TS val 3573 ecr 3542,eol], length 536
3.578687 IP 10.1.3.1.49153 > 10.1.1.2.50000: Flags [.], seq 86833:87369, ack 1, win 32768, options [TS val 3573 ecr 3542,eol], length 536
3.583407 IP 10.1.1.2.50000 > 10.1.3.1.49153: Flags [.], ack 85225, win 32768, options [TS val 3552 ecr 3503,eol], length 0
3.583407 IP 10.1.3.1.49153 > 10.1.1.2.50000: Flags [.], seq 87369:87905, ack 1, win 32768, options [TS val 3583 ecr 3552,eol], length 536
3.588127 IP 10.1.3.1.49153 > 10.1.1.2.50000: Flags [.], seq 87905:88441, ack 1, win 32768, options [TS val 3583 ecr 3552,eol], length 536
3.592847 IP 10.1.1.2.50000 > 10.1.3.1.49153: Flags [.], ack 86297, win 32768, options [TS val 3561 ecr 3512,eol], length 0
3.592847 IP 10.1.3.1.49153 > 10.1.1.2.50000: Flags [.], seq 88441:88977, ack 1, win 32768, options [TS val 3592 ecr 3561,eol], length 536
3.597567 IP 10.1.3.1.49153 > 10.1.1.2.50000: Flags [.], seq 88977:89513, ack 1, win 32768, options [TS val 3592 ecr 3561,eol], length 536
3.654143 IP 10.1.1.2.50000 > 10.1.3.1.49153: Flags [.], ack 87369, win 32768, options [TS val 3622 ecr 3573,eol], length 0
3.654143 IP 10.1.3.1.49153 > 10.1.1.2.50000: Flags [.], seq 89513:90049, ack 1, win 32768, options [TS val 3654 ecr 3622,eol], length 536
3.658863 IP 10.1.3.1.49153 > 10.1.1.2.50000: Flags [.], seq 90049:90585, ack 1, win 32768, options [TS val 3654 ecr 3622,eol], length 536
3.663583 IP 10.1.1.2.50000 > 10.1.3.1.49153: Flags [.], ack 88441, win 32768, options [TS val 3632 ecr 3583,eol], length 0
3.663583 IP 10.1.3.1.49153 > 10.1.1.2.50000: Flags [.], seq 90585:91121, ack 1, win 32768, options [TS val 3654 ecr 3622,eol], length 536
3.668303 IP 10.1.3.1.49153 > 10.1.1.2.50000: Flags [.], seq 91121:91657, ack 1, win 32768, options [TS val 3663 ecr 3632,eol], length 536
3.673023 IP 10.1.1.2.50000 > 10.1.3.1.49153: Flags [.], ack 89513, win 32768, options [TS val 3641 ecr 3592,eol], length 0
3.673023 IP 10.1.3.1.49153 > 10.1.1.2.50000: Flags [.], seq 91657:92193, ack 1, win 32768, options [TS val 3663 ecr 3632,eol], length 536
3.677743 IP 10.1.3.1.49153 > 10.1.1.2.50000: Flags [.], seq 92193:92729, ack 1, win 32768, options [TS val 3673 ecr 3641,eol], length 536
3.682463 IP 10.1.3.1.49153 > 10.1.1.2.50000: Flags [.], seq 92729:93265, ack 1, win 32768, options [TS val 3673 ecr 3641,eol], length 536
3.734319 IP 10.1.1.2.50000 > 10.1.3.1.49153: Flags [.], ack 90585, win 32768, options [TS val 3703 ecr 3654,eol], length 0
3.734319 IP 10.1.3.1.49153 > 10.1.1.2.50000: Flags [.], seq 93265:93801, ack 1, win 32768, options [TS val 3734 ecr 3703,eol], length 536
3.739039 IP 10.1.3.1.49153 > 10.1.1.2.50000: Flags [.], seq 93801:94337, ack 1, win 32768, options [TS val 3734 ecr 3703,eol], length 536
3.743759 IP 10.1.1.2.50000 > 10.1.3.1.49153: Flags [.], ack 91657, win 32768, options [TS val 3712 ecr 3654,eol], length 0
3.743759 IP 10.1.3.1.49153 > 10.1.1.2.50000: Flags [.], seq 94337:94873, ack 1, win 32768, options [TS val 3743 ecr 3712,eol], length 536
3.748479 IP 10.1.3.1.49153 > 10.1.1.2.50000: Flags [.], seq 94873:95409, ack 1, win 32768, options [TS val 3743 ecr 3712,eol], length 536
3.753199 IP 10.1.1.2.50000 > 10.1.3.1.49153: Flags [.], ack 92729, win 32768, options [TS val 3721 ecr 3663,eol], length 0
3.753199 IP 10.1.3.1.49153 > 10.1.1.2.50000: Flags [.], seq 95409:95945, ack 1, win 32768, options [TS val 3753 ecr 3721,eol], length 536
3.757919 IP 10.1.3.1.49153 > 10.1.1.2.50000: Flags [.], seq 95945:96481, ack 1, win 32768, options [TS val 3753 ecr 3721,eol], length 536
3.809775 IP 10.1.1.2.50000 > 10.1.3.1.49153: Flags [.], ack 93801, win 32768, options [TS val 3778 ecr 3673,eol], length 0
3.809775 IP 10.1.3.1.49153 > 10.1.1.2.50000: Flags [.], seq 96481:97017, ack 1, win 32768, options [TS val 3809 ecr 3778,eol], length 536
3.814495 IP 10.1.3.1.49153 > 10.1.1.2.50000: Flags [.], seq 97017:97553, ack 1, win 32768, options [TS val 3809 ecr 3778,eol], length 536
3.819215 IP 10.1.1.2.50000 > 10.1.3.1.49153: Flags [.], ack 94873, win 32768, options [TS val 3787 ecr 3734,eol], length 0
3.819215 IP 10.1.3.1.49153 > 10.1.1.2.50000: Flags [.], seq 97553:98089, ack 1, win 32768, options [TS val 3819 ecr 3787,eol], length 536
3.823935 IP 10.1.3.1.49153 > 10.1.1.2.50000: Flags [.], seq 98089:98625, ack 1, win 32768, options [TS val 3819 ecr 3787,eol], length 536
3.828655 IP 10.1.1.2.50000 > 10.1.3.1.49153: Flags [.], ack 95945, win 32768, options [TS val 3797 ecr 3743,eol], length 0
3.828655 IP 10.1.3.1.49153 > 10.1.1.2.50000: Flags [.], seq 98625:99161, ack 1, win 32768, options [TS val 3819 ecr 3787,eol], length 536
3.833375 IP 10.1.3.1.49153 > 10.1.1.2.50000: Flags [.], seq 99161:99697, ack 1, win 32768, options [TS val 3828 ecr 3797,eol], length 536
3.838095 IP 10.1.3.1.49153 > 10.1.1.2.50000: Flags [.], seq 99697:100233, ack 1, win 32768, options [TS val 3828 ecr 3797,eol], length 536
3.885231 IP 10.1.1.2.50000 > 10.1.3.1.49153: Flags [.], ack 97017, win 32768, options [TS val 3853 ecr 3753,eol], length 0
3.885231 IP 10.1.3.1.49153 > 10.1.1.2.50000: Flags [.], seq 100233:100769, ack 1, win 32768, options [TS val 3885 ecr 3853,eol], length 536
